{
  "id": "npc.mentor",
  "version": 1,
  "display_name": "Mentor",
  "kind": "npc",
  "tags": [],
  "interactable": true,
  "transform_default": {
    "position": {
      "x": 0.0,
      "y": 0.0,
      "z": 0.0
    },
    "rotation": 0.0
  },
  "avatar": {
    "hp": 100.0,
    "stamina": 100.0
  },
  "brain": {
    "kind": "Utility",
    "seed": 42
  },
  "sprite": {
    "path": "sprites/mentor.png",
    "size": 32
  }
}
